Histtorical Painting,1450 - 1875,"Large monumental, realistic paintings and sculpture of non-religious historic events usually in 19th century. Heroism. No visible brushstrokes. Many figures. Classical style.","Inspired, awed, impressed, influenced by events, heros and message, heroism, values of ancient societies.",It was regarded as the highest form of painting. Represented height of the concept of The Art Establishment causing a rebellion of other art movements. It was the only accepted respectable career path of art style. It elicited a counter response from distainful Impressionist artists.,"There became an increased demand for paintings of scenes from history, including contemporary history, a desire for more ambitious paintings. There was a desire for propaganda institutions who could afford the art.  Execution demonstrated great technical art skill and production capability and was thus supported by the art establishments as the highest form of art. Artists reputations were built in public exhibitions rather than by impressing the owners of and visitors to palaces and public buildings. Classical history remained popular, but scenes from national histories were often the best-received. Nationalism promoted a need for a narrative of national history.","Broader number and participation of artists looking to express themselves differently without the restrictions of being judged by ""The Establishment"" which regarded historical painting as the highest form of painting. Church commissions for large group scenes from the Bible had greatly reduced.","Large scale of painting with many figures. Historical-based, non-religious subjects. A moment in a narrative story, subjects from history. Presence of flags, coat of arms, focus on few important men, horses, battle scenes, signing documents, large congress of men.","Government propaganda was supported by the French state, but after the fall of Napoleon in 1815 the French governments were not regarded as suitable for heroic treatment, though victorious Britain depicting the victories of the Napoleonic Wars mostly occurred after they were over. ","""...he who becomes an imitator of God in representing human figures, is much more excellent than all the others..."" - André Félibien.  ""Modernism was to a considerable extent built upon the rejection of History Painting... All other genres are deemed capable of entering, in one form or another, the 'pantheon' of modernity considered, but History Painting is excluded"". ""History painting of a debased sort, scenes of brutality and terror, purporting to illustrate episodes from Roman and Moorish history..."".  ""...the paintings that shouted loudest got the attention"".","Greek heroism was the inspiration. Emphasis on the realistic depiction of the human form and environment. Excellent painting techniques with very little hint of brush strokes. Many figures were used due to representation of important large events and battles. The unheroic nature of modern dress was regarded as a serious difficulty thus classical costume was preferred by many people. Artists depicted scenes, regardless of when they occurred, in classical dress. Often depictions of the heroic male nude. Print making was broadly used and distributed.

","Stories based on Greek heroism and mythology. 19th century historically-based non-religious subjects. A moment in a narrative story, subjects from history. Document signing, battles, meetings, government bodies, presence of flags, coat of arms, focus on few important men.","Paris, France.","Greek, Roman clothes were preferred as ""heroic"". In 1770, Benjamin West, an American,  proposed to paint in the historically accurate clothes. He was firmly rejected but eventually succeeded in changing tastes.","Painting, Sculpture, Monuments","Chromolithograph (new printing technique) allowed cheap accessible, and also hugely profitable for artist and publisher. Oil paint, marble, friezes.",null
Academic Classicism,1865 - 1920,"Technically accurate painting, smooth, slick, idealized in perfect detail with no brush strokes or canvas texture. State-sponsored.","Appreciation for the artistic technique and mastery. Glorification of all the past, glorification of nature, beauty. Seriousness, severity, exoticism, the subject's emotions, passion, sensitivity, imagination, apprehension, horror and terror, awe. Calm granduer, achievements of ""heroic"" individualists and artists, individualism, nationalism, order, patriotism, civility, republicanism, civility, honorableness, the struggle for independence.","Usually the largest most technically awe inspiring art you see. It is the state-sponsored, controlled art establishment from which many other famous movements (e.g. Impressionism) rebelled. It was taught and instituionalized at scale so that countries could compete to be cultural centers of the world. At the time the only respectable commercially accepted style.","Cultural nationalism. Governments wanting to control, sponsor and compete as cultural centers focusing state sponsorship to increase technical excellence and skill of country artisans often with the political control of the arts.","Became dated, trite and ""kitsch"". A natural desire of artists and people to react and evolve away from ""the establishment"" which favored the copying of an ancient art form, had ridged style rules and who's art was too realistic, idealized, polished, finished. Many rebelling artists felt contemporary social concerns were being ignored.","Art was excuted under institutionally tight sets of rules. A highly finished, smooth, slick artwork with perfect detail showing no brushwork or real texture. Drawings and paintings of the nude, called ""académies,"" were the basic building blocks of academic art. Individual nude figures were idealized—in order to be able to represent the ideals for which they stood. Preferred Raphael, for the ideality of his work, over Michelangelo.",Governments wanted their countries to direct art and compete with other countries excelling in arts and crafts. The Medici's organized the first academy to supervise the whole artistic production of the Medicean state (state propaganda).,"""The only way for us to become great and possibly inimitable is to imitate the ancients."" Only based on idealistic clichés and representing mythical and legendary motives while contemporary social concerns were being ignored. ""False surface"" of paintings—the objects depicted looked smooth, slick, and idealized—showing no real texture. Too finished and idealized. Sentimental, clichéd, conservative, non-innovative, bourgeois, and ""styleless"". Manufactured false emotion through contrivances and tricks. Old-fashioned with the allegorical nudes and theatrically posed figures seemly bizarre and dreamlike.","Objects depicted looked polished, smooth, slick, and idealized, finished showing no real texture.","Historical, drawings and paintings of the nude (""académies""), mythological, allegorical (e.g.: single nudes representing Dawn, Dusk, Seeing, and Tasting), classical, religious, chrisitan, catholic, literary, portraiture, still-life, landscape.","Paris, France; Florence, Italy; Rome, Italy; Accademia di San Luca, Piazza Accademia di S. Luca, 77, 00187 Roma RM, Italy;  Accademia delle Arti del Disegno, Via Orsanmichele, 4, 50123 Firenze FI, Italy; École des Beaux-Arts, 14 Rue Bonaparte, 75006 Paris, France;  Academy Des Beaux-Arts, 23 Quai de Conti, 75006 Paris, France; Villa Medici, Viale della Trinità dei Monti, 1, 00187 Roma RM, Italy; Grand Palis, 3 Av. du Général Eisenhower, 75008 Paris, France","Academies made training more difficult for women artists, who were excluded from most academies until the last half of the 19th century (1861 for the Royal Academy) partly because of concerns over the impropriety presented by nudity. Drawing was considered the superior form and building block thus many academies never accepted painting until later.","Drawings, oil paint on canvas, drawings, sculpture, monumental canvas sizes","Drawings, oil paint, marble, stone.",null
Impressionism,1860 - 1895,"Thick paint, visible, lose brush strokes.","Pleased when viewing fun brush strokes and bright colors of the simple moments in time, nature and ordinary things in life.","Extremely popular art style. Was an jarring, historically dramatic break from the commercial and popularly acceptable art form of it's time.",A rebellion against the Academic Classicism style where 'what was art' was judged by a narrowly focused art establishment with tight guidelines of how to make art. Impressionists wanted to advance creative expression and subject matter art beyond polished detailed painting technique that was totally focused on monumental historical events and classical subjects.,"Impressionism gave way to Post Impressionism which was a reaction to the Impressionist's being too focused on the naturalistic depiction of light and color, the loss of structure and their trivial of subject matter. Post-Impressionists extended impressionistic techniques while rejecting its limitations: they continued using vivid colours, often thick application of paint, and real-life subject matter, but were more inclined to emphasize geometric forms, distort form for expressive effect, and use unnatural or arbitrary colour. Led to Cubism and Surrealism.","Painted quickly and often outdoors with bright colors and thick paint to catch unique colors, shadows and contemporary French life.","The Franco-Prussian (1870) war fragmented Impressionist artists.Daubigny, Monet and Pissarro fled to London and painted. Other's fought and died. Paris was under seige by the Prussians for nine brutal months.","""...Wallpaper in its embryonic state is more finished than that seascape."". Louis Leroy to coined the term in a satirical review published in the Parisian newspaper Le Charivari. Looked like slap-dash impressions and consider these paintings works “finished.”","The paint is applied to a white or light-coloured background. Exaggerated, thick globs of paint with strong, visible often short, broken brush strokes are applied in a thick paint surface with no transparency between paint layers. Use of bold blocks of a varied use of color in a bright color palette where the play of natural, bright light is emphasized. No use of black paint. Pure unmixed colour—not blended smoothly or shaded. Colors applied side by side with as little mixing as possible. Greys and dark tones are produced by mixing complementary (e.g.: blue and orange) colors. Close attention is paid to the reflection of light and colors from object to another object. Shadows are boldly painted in color where the blue of the sky is reflected onto surfaces in the shadows.","Still lifes, portraits, landscapes, the ordinary, contemporary lifestyle, realistic scenes of modern domestic social life","Paris, France; Paris, Café Guerbois","During the Paris Commune (1871), the painter Gustave Courbet, president of the Federation of Artists, helped pull down the Vendome column because it was a memorial to war.",Painting,Zinc tube packaged oil paint (invented 1841) and  watercolor allowed outside painting.,null
Post-Impressionism,1882 - 1915,"Unnatural, arbitrary light and color (red tree trunks, blue faces). Strong outlines and blocks of color. Geometric shapes (paint dots, planes of color), distorted forms and perspective for expressive effect.","Spiritual, expressions of the emotions of the artists, emotions in the subjects.","A period of popular and attractive use of color and brushstrokes producing culture's most powerful and immense personalities such as Paul Cezanne, Vincent van Gogh, Paul Gauguin.","Post impressionism was a reaction to the Impressionist's being too focused on the naturalistic depiction of light and color, the loss of structure and their trivial of subject matter. Post-Impressionists extended Impressionistic techniques while rejecting its limitations: they continued using vivid colours, often thick application of paint, and real-life subject matter, but were more inclined to emphasize geometric forms, distort form for expressive effect, and use unnatural or arbitrary colour.",Cubism' was an absolutely fresh start. Cloisonnism's use of the separation of colors reflects an appreciation for discontinuity that is characteristic of future modernist movements.,"Emphasises individuality, pure color, organization and form. You will see geometric forms, arbitrary use of different and vibrant colors an open composition, thick strokes of paint. A natural light often painted outside en boating, leisure activities, Landscapes, modernization, synthetic pigments, industrialization, physics of colour, broader strokes, fleeting impression of colour and light, bright, vibrant, flowers, figures. Vivid colours, thick application of paint, real-life subject matter, geometric forms, distort form for expressive effect, unnatural, arbitrary colour. Reducing objects to their basic shapes while retaining the saturated colours of Impressionism.",WW I marked the ending of Post-Impessionism and diminished impact of European art culture.,“ I dream of painting and then I paint my dream.” - Vincent van Gogh.,"Emphasises individuality, pure color, organization and form. You will see geometric forms, arbitrary use of different and vibrant colors an open composition, thick strokes of paint. A natural light often painted outside en boating, leisure activities, Landscapes, modernization, synthetic pigments, industrialization, physics of colour, broader strokes, fleeting impression of colour and light, bright, vibrant, flowers, figures. Vivid colours, thick application of paint, real-life subject matter, geometric forms, distort form for expressive effect, unnatural, arbitrary colour. Reducing objects to their basic shapes while retaining the saturated colours of Impressionism.","Contemporary scenes of life in the 19th century, landscapes, City of Paris, Parisian cafe culture, the modernization and industrialization of France, flowers and human figures, boating, leisure activities.","Paris, France; Grafton Galleries, Mayfair, London, England","Van Gough painted for nine years, produced 900 paintings and sold two paintings.",Painting,Oil paint.,null
Art Nouveau,1890 - 1920,"Nature, curves, vines, plants, flowing lines, symbolic figures.",Opulence and beauty.,Still a popular and pervasive art form to understand.,"Artists were inspired by nature in rejection of the tawdry production values and dehumanising aspects of previous Victorian, capitalism period. They wanted to unify all the arts such as  fine art painting and sculpture and the so-called lesser, decorative arts such as furniture and lamps. It sought to integrate art with the everyday utility and experience producing beautiful objects to elevate people's lives.",Modern art such as Art Deco became more popular and different.,"Flowing, oppulant ,curvy, exotic forms in many different formats and building materials such as: stained glass, sculpture, paintings, portraiture, still life, furniture design, silverware, architecture, graphic arts, jewelry, fashion, glassware and ceramics.",Modernism rejected the organic ornamentation of Art Nouveau as being the last gasp of bourgeois decorative excess.,"""Art for art's sake"" - French philosopher, Victor Cousin.","The integration into all objects of a flowing oppulant curvy, exotic forms using many different materials into everyday forms. ","Animals, birds, butterflies, dragonflies, peacocks, cranes, swans, Japanese subjects, classical subjects, poetic themes, insects, naturalist illustrations, floral ornaments, vegetals, geometric stylistic elements, exotic creatures of the deep, nautical lifeforms, crustaceans, jellyfish, sea anemones, mythology, sirens, nymphs the Four Seasons.","Paris, France","Oscar Wilde became associated with the saying “art for art’s sake,”  about this period. Because he advocated that art needed no justification or purpose. ","Posters, decorative arts, furniture.","Cast iron, steel, ceramics, glass, wood, reinforced concrete.",null
Cubism,1905 - 1920,"Reality deconstructed into distinct basic geometric forms, triangles, squares, corners, straight lines with graduated colored shading.","A sense of deconstruction of reality with a new way of seeing things. An abstraction, expressive allusive feeling dedicated to complex emotional and sexual themes. ",Introduced and energized a new form of modern art and beginning the fame of Pablo Piccaso. Generated multiple 20th century art movements still popular today such as Art Deco. Established the beginning of Picasso's fame as a modern artist. The beginning of collage materials being introduced as an important ingredient of fine art work by the avant-garde.,"It was a new, radical way of seeing, shaping and renewing perception for the modern age person who liked difference. It revitalise then boring traditions (e.g. perspective) of Western art.","Cubism evolved. It contributed and refined over the 20th century spawning new forms such as: Art Deco, Vorticism, Futurism, and Suprematism's fundamentalism.","Abstraction by renedering images into squares, corners and diagonals.","Picasso was influenced by African masks for his early efforts in cubism. His contemporaries thought he was ""mad"" to pursue cubism. Picasso and Braque played off of each other's efforts pushing the concepts forward.","Matisse considered the work something of a bad joke yet indirectly reacted to it in his 1908 Bathers with a Turtle. ""...bizarreries cubiques"" (""cubic oddities"") -  art critic, Louis Vauxcelles.","Flat two-dimensional surfaces of the picture plane. Non-traditional perspective, foreshortening, modeling, and chiaroscuro. Rejection of honoured theories that art should imitate nature. Avoidance in copying form, texture, color, and space. Highly fragmented objects and elements. Different textures, surfaces, collage elements, papier collé and a large variety of subject matter.","Figures, portraiture, still life, landscape, mechanization, modern life","Paris, France","Gertrude Stein and Matisse thought Picasso was ""mad"" when seeing his early cubism work. Others: ""What do they mean? Have those responsible for them taken leave of their senses? Is it art or madness? Who knows?""","Painting, sculpture","Oil paint, multi-media, collage, papier collé.",null
Art Deco,1915 - 1940,"Sleek, polished, geometric.","A sense of luxury, glamour, exuberance, and faith in social and technological progress. Modernity.",Was one of the first truly international styles.,"It evolved cubism to another form as a reaction against the then popular Art Nouveau's soft, curvey organic-like flourishes and was inspired by Vienna Succession, Cubism, the Nabis and  the artist Odilon Redon.",The start of WWII and the rise of the strictly functional and unadorned styles of modernism replaced the taste for Art Deco.,"A sleek style of geometric volumes of trianglular and square design elements using symmetry and straight lines for making bodies and forms. Art Deco was an explosion of colors, featuring bright and often clashing hues.",Happened between to world wars and included the U.S. Stock Market crash. France sponsored the Exposition Internationale des Arts Décoratifs et Industriels Modernes in 1925 to promote modern art.,"...practical objects such as furniture should not have any decoration at all...""Modern decoration has no decoration"".","Made distinctive in using: modern sleekness, metallic colors, bold geometric forms, bright often clashing colors, rare and expensive materials, ebony and ivory, chrome plating, stainless steel, and plastic. Smooth, polished surfaces, symmetrical, straight lines. Concrete covered with marble plaques, finely-sculpted ornament, and lavish interiors, including mosaic friezes. clashing hues, frequently in floral designs, presented in furniture upholstery, carpets, screens, wallpaper and fabrics. Ivory and silver inlays. Diamonds with platinum, jade, and other precious materials.","Classical, mythological, heroic, allegorical, exotic, stylized female figures, contemporary life in the 20's, civic and industrial activity.","New York City, NY; Paris, France. The Chrysler Building, Rockefeller Center and other skyscrapers of New York built during the 1920s and 1930s are monuments of the Art Deco style. Shanghai. Miami, Florida has entire neighborhoods of protected art deco architecture.","Celebrities like Jack Nicholson, Barbara Streisand and Madonna are known as the collectors of Tamara de Lempicka's paintings.","Painting, sculpture, luxury furniture, architecture, decorative goods.","Exotic, expensive materials such as ivory, jewels, stones used in luxury furniture, porcelain, glass, metalwork, textiles, and other decorative products. New technologies in: plate glass, mass-production of aluminum, reinforced concrete.",null
Expressionism,1901 - 1950,"Distorted reality, exaggeration, primitivism, fantasy using vivid, jarring, violent, or dynamic application of brush strokes and paint for impact not reality. Emotional responses to objects and events. Think: Van Gough, The Scream.","Angst. Sympathy with the artists distorted reality evoking emotional moods and or ideas in yourself. Feeling the meaning of emotional experience rather than the physical reality. Possibly experiencing a variety of anxieties and yearnings of ordinary people. Understanding the emotional expression from within the artist, a turgid emotional state, possibly an anxiety from the modern world with some social criticism. Considering the rejection of capitalism's role in the emotional distancing of individuals within cities. Opposition to what Impressionism represents. See a disillusioned commentary on contemporary society.",The style represents a significant departure from the path of art escaping reality and leaps to another concept of what art itself should be. The Scream by Edvard Munch placed him as one of the greatest artists in world history,"Evolved as a response to a widespread anxiety about humanity's increasingly discordant relationship with the world after the World War I, Depression, World War II, and accompanying lost feelings of authenticity and spirituality. Internal feelings in reaction to external looking Impressionism and Academic art.","Expressionism fell out of favor post WW I and was banned by the Nazi dictatorship in 1933 as degenerate. Artworks were taken out of galleries and seized. Expression art inspired development of a multitude of later art movements, with its characteristics still used today.",Striking colors and vigorous brush work and application of paint in seemingly irrational ways. Often addresses the darker side of life. Heavily influenced by primiative native art form.  Overemphasis of the emotions highlighting their importance over a realistic interpretation within the artworks. Threatening and sinister depictions of the modern city.,"Considered ""Degenerate"" art by Nazi regime so it attempted to humiliate artists and destroyed all such artworks.",“The function of the artist is to express reality as felt.” - Robert Motherwell. “Degenerate.” ,"Striking colors and vigorous, bold brush work and application of paint more to get a reaction than to accurately reflect and object. Use of extreme angles, flattened forms, garish colors, and distorted views.",Contemporary life. A world view,"Germany, New York City, NY","Munch accidentally shot off his finger which had to be amputated. He turned down anesthesia in order to paint the operation afterwards, and needed to stay awake and see what happened. Munch played with early cameras and was considered a selfie pioneer.",Painting,"Oil paint, household paint, multiple different industrial and household materials. ",null
