Abstract Expressionism,1945 - 1965,Dripped paint. Large canvases. No recognizable figures or objects. An emotionally charged application of medium.,"The artist's feelings and emotions, rebellious, anarchic, highly idiosyncratic, meaninglessness of life, rejection of social, religious and moral principles.","It dramatically broke through the confining, restrictive art establishment rules.  Opened up new world of modern art and the of enjoyment and expression of artists and viewers feelings. Also, it was the first American movement to move international art influence from Paris to New York.","The unrelenting nature of artists to be unique, to find something new and different and add to what has been done before. WWII was the important historic point. Abstraction hide social and political statements during an intolerant period and therefore safe for artists.","Artists grew tired of abstract expressionism's subjective nature and moved to a multitude of new art forms such as: Surrealism, Color field, Hard-edge and Lyrical Abstraction among others.","Spontaneous, automatic, or subconscious, emotional creation of solid color or dripped painting. Anti-figurative. Non-objective style. Application of medium with emotional energy and gestural surface marks. Total coverage of fields of color cool and austere color across the entire canvas. Large, flat areas of color. Use of large canvases, an ""all-over"" approach, in which the whole canvases are treated with equal importance (as opposed to the center being of more interest than the edges). Drip paintings as vast fields of built-up linear elements often reading as vast complexes of similar valued paint skeins that read as all over fields of color and drawing. Staining fluid oil paint and house paint into raw canvas. Intense stained fields of color, often letting the paint run and drip, under and around his familiar lexicon of organic and biomorphic shapes and delicate lines. Hard-edge painting in which abrupt transitions are found between color areas. Color areas are often of one unvarying color.","WWII ended. There was significant Western, U.S. government and societal censorship. CIA sponsored this art form against communist art influences.","""...what was to go on the canvas was not a picture but an event..."" — Harold Rosenberg","Unrestricted brush strokes and application of materials, experimentation with different materials to express feelings.","Emotional, anti-social, anti-religious, rejection of current morals, anti-political, apolitical, mythology, mysticism.","New York City, New York, United States; San Francisco, California, United States; East 9th Street, Manhattan, New York, NY","In the early 1950s, the anti-communist CIA saw the art form as a haven of free thought and free markets thus a challenge to both the socialist realist styles prevalent in communist nations. Thus the CIA financed and organized the promotion of American abstract expressionists as part of cultural imperialism.","Paints of all types, sculpture, mobile, collage","Paint, industrial paint, materials, metals, collages, multiple different industrial and household materials. ",null
Fauvism,1904 - 1908,"Bright, intense. pure (not mixed with other colors), unrealistically applied colors. Green skin, purple tree trunks. ",Unsettled.,"This brief but intense movement impacted many giants in art today such as Matisse. A unique collision of  influences of Van Gogh, Impressionists, Cézanne, Paul Gauguin and Gustave Moreau with newly developing artists such as Matisse, Vlaminck and Derain. ","Gustave Moreau (painter / teacher) inspired his artists to push and disturb current art establishment complacency. Van Gogh's color use also contributed. Different African and Oceanic art, alongside other forms of non-Western and folk art were popular and infuential at this time.",While the impact continued the small number of artists moved into derivitive and different styles.,Unsettling mismatch of colors used to represent objects.,"Some Fauves were among the first avant-garde artists to collect and study African and Oceanic art, alongside other forms of non-Western and folk art.","""A pot of paint has been flung in the face of the public."" Louis Vauxcelles disparaged the painters as ""fauves"" (wild beasts). An ""orgy of pure tones"". ""A pot of paint has been flung in the face of the public"". Critics were horrified by its flatness, bright colors, eclectic style and mixed technique.","Pure, flat, bright pure colors aggressively applied with vigorous brush strokes and thick paint, straight from the paint tubes to create a sense of an explosion. Unnatural color selection. Brown is purple, green is pink. Wild brush work and strident colors, subject simplification and abstraction. Primitive and less naturalistic. African and Oceanic art influences. Expressive potency of pure color. Eclectic style, mixed techniques. Colors of golden yellows, purples, incandescent blues. Rejection of traditional three-dimensional space and instead using flat areas or patches of color to create a new pictorial space.","Portrait, Still Life, Landscapes","Paris, France.","Critic Louis Vauxcelles disparaged the painters as ""fauves"" (wild beasts) thus becoming the movement's name.","Oil Painting, Canvas.",Oil paints.,null
Northern Renaissance,1350 - 1500,"Darker tones and palette. Stiff poses. Precise, detailed, realistic and sometimes a grotesqueness of people. More landscapes. Lots of complex symbolism.","Somberness, moral, simplistic piety, spiritual, virtuous, humble.","Dominant in major areas of Europe such as Germany, Switzerland, Austria, and the Low Countries (e.g. Netherlands). It provided major exposure of the principles of a more humble, toned down protestant viewpoint. Artists advanced the use of painting with oils (pigment and lindseed oil) thus influencing all of Renaissance artists.","1430, was influenced by developing Early Italian Renaissance techniques. They began using linear perspective, realistic figures and other new techniques. The chaos and upheaval of the catholic church meant that there was no single artistic nucleus. Italian trade and printing. Expansion of religious subject matter to more real, human subjects. Discovey of classic liturature, sculpture. Translation of the Bible to German and French. ","Decline in Northern Europe followed Italy, just a little later. In Italy Mannerism became more popular. The Renaissance had achieved all artistic ideals, solved all problems. Young artists needed to find new expressions. Mannerism emerged.","Detailed brush strokes and painting style. Precise observation and naturalism, realistic and sometimes a grotesqueness of people. A detailed realism with use of Gothic elements and influence. No ""decadent"" Greek and Roman influences of Italian Renaissance and aversion to overblown religious themes but simplie devotional piety.","The new invention of printmaking (1436) in Northern Europe provided mass production and exposure to Protestant themes in Northern Reniassance art. Art and artists gained exposure with books, prints, engravings, and pamphlets building a new economy and fame of for artists themselves as well as their subjects.","""...The Germans, on the contrary (to Italians), had only one model: nature. Also if their poses have some stiffness, so their heads are almost all portraits, they have great charm and delicious naiveté in expression. In a way, they are closer to the truth."" - Albert Durer.",Darker tones and palette. More detailed reproduction of objects and their complex symbolic meaning than with the study of scientific perspective and anatomy even after these achievements became widely known. Artist used oil paints which allowed glazing (many thin transparent layers) and impasto (noticably thick layers strokes of paint).,"Somber moods and darker psychological undertones and complicated symbolism. Common domestic scenes, moralistic themes. Landscape, portrait, animal, still life, biblical narrative, and rural labor and everyday life paintings. Specifically: Portraiture, landscape, genre, alleogry, philosophical, humor, satire, domestic scenes, merchants at work,  peasants in the fields and play, fantastical landscapes, dogs, cats, birds, children, household goods, nature, anatomy, perspective, architecture, accessories, actual life of the present, secular society. Devotional piety, spirituality, and living a simple life. A religous education, ritual and cultic practices, portrayal in tangible form the principles of Christianity, to conclusively identify biblical, religious scenes, convey religious meaning.","Northern Europe; North of Alps, Switzerland; Nuremberg, Germany; Austria; France; Britain; Low Countries, Flanders, Bruges; Poland","In addition the first to perfect oil painting the Dutch artists were some of the first western artists to specialize in landscapes. ""Renaissance"" is a French word that means ""rebirth"".","Painting, portraiture, prints, wood sculptures, engraving, altar painting.","Oil painting using pigments and linseed oil (and nut oil) was introduced to Europe by Northern Renaissance artists (earlest is is 7th century AD). Printing technology (1436) created: books, prints, engravings, and pamphlets. Woods for sculpture.",null
Realism / Naturalism,1850 - 1900+,"Realistic subject of art not the method. Stark, truthful, unidealized, realistic painting of everyday common scenes and laborers and nature. Rejected the overly emotional, romantic, unreal and unnatural.","Rebellion, sympathy to ordinary people and workers, social awareness, political awareness, toil, life's difficulties, challenges.",It is regarded as the beginning of the modern art movement pushing to incorporate modern life and art together. Photography became important medium. Realism spread all over Europe and to as far as Russia.,"Artists rejected the exotic subjects, drama, and exaggerated emotionalism of the dominant Romantic movement. The realism of photography emerged. A series of French rebellions involving laborers promoted a spirit of rebellion. The Historical Painting (large, grand, state-sponsored artworks) movement was an ""establisment"" art movement, thus rejected as well.","Still popular now it has become diluted, fragmented and morphed into new movements. In some places reclassified as anything not ""abstract"" or ""surreal"".","The real-life ""content depicted"" rather than the ""realistic method"" of painting.",Influenced by The 1848 Revolution. It was part of a wave of revolutions in 1848 in Europe that involved incidences of bloody but unsuccessful rebellion by the Paris workers. ,"""Labor was a major issue in the second half of the century due to decades of industrialization.."" - Art History Teaching Resources.","Generally the attempt to represent subject matter truthfully, without artificiality and avoiding artistic conventions. Accurate depiction of lifeforms, perspective, and the details of light and color. Scenes and objects are depicted with great skill and care. Avoids artistic conventions, or implausible, exotic, and supernatural elements (but did paint angels). Naturalism, a sub-movement of Realism, avoided politics and social issues focusing soley on nature. ""How"" a subject is painted, rather than ""who"" or ""what"" it is.","Social realism and labor. Rural lifestyle, daily lifestyle of everyday people and laborers, social realism, contemporary life, still lifes, flowers, landscapes. Naturalism, as a sub-movement, avoided politics and social issues.","England, France, Germany, Northern Europe, Russia.","Little to no realism sculpture or architecture.  Famous painter / activist Gustov Courbet was involved in pullng down memorial column with Napoleon atop in the Place Vendôme. Unable to pay restitutions, Courbet went into self-imposed exile in Switzerland.","Photography, Oil Painting, Canvas.","Photography, perfect for realistic depiction of life. Oil painting.",null
Romanticism,1750 - 1860,"Not literally ""romantic"" subjects. Moody. Exaggerated dipictions of nature, ethereal and foggy backgrounds. Unrestrained visible brushstrokes, lots of color.","Intense emotions. Individualistic, exotic, beautiful, apprehension, horror, terror, and awe. Passion, sensitivity, and imaginative. The glory of the past. The importance, awe-inspiring, healing aspect and beauty of nature. Medieval in the attempt to escape population growth, early urban sprawl, and industrialism. Distrustful of the human world.  A restless spirit, striding beyond old and cramping forms. Longing for the unbounded and the indefinable, for perpetual movement and change. Heroic individualism, self-assertion both individual and collective. Patriotism, nationalism. Struggling for independnce.","A worldwide influential art movement and a philosophy you will see in literature, music, art, architecture, theology and much more.","Challenged the approach of Enlightenment. Emotions, not logic and reason. Sought a stronger connection to nature.",The English Romantic Period officially ended with the coronation of Queen Victoria in 1837. The Industrial Revolution began as the working class became dominant in the culture.,"Moody, themes of nature and heroic individualism.",Nationalism and independence movements were sweeping the world. The ideologies of the French Revolution influenced many early Romantics who were cultural revolutionaries and sympathetic to the revolution. The 1815 Napoleonic Wars had societal impact. The theory of evolution was growing in popularity.,"""the artist's feeling is his law"" - David Friedrich. “Romanticism is precisely situated neither in choice of subject nor in exact truth, but in a way of feeling,” - Charles Baudelaire.","Unrefined outlines, unrestrained brushstrokes, and the emphasis on color over form makes the painterly style the choice of the Romantics. Visible brushstrokes, which lend themselves to an energy and immediacy to the painting. Ethereal and foggy Backgrounds. 3D drawing and representation.","Not literally ""romance"" subjects. Landscapes, wild landscapes, storms and the overwhelming awe-inspiring impact of and connection to, nature. Glory of the past. Patriotism, nationalism, struggle for independence. Medieval rather than the classical.","Paris, France. England. Worldwide.","""Romantic chess"" emphasized quick, tactical maneuvers characterized by aesthetic beauty rather than long-term strategic planning.","Painting on canvas, scultpture.",Oil painting.,null
Surrealism,1924 - 1969+,"Startling, mad, weird, using strange images. More a philosophy and unconscious thoughts than an art form.","Surprised, startled, philosophical, dream-like, unnerved, illogical, disoriented, an enhanced emotional intimacy, empathy.

","Extremely influential form of art and widespread with a remarkably different style of radical looking art with many recognized artist names (Dalí, Magritte). It is often used to symbolize what is modern art.","Artists wanted to represent philosophy not subject matter. Freud's work with free association, dream analysis, and the unconscious was an influence. The group aimed to revolutionize human experience, in its personal, cultural, social, and political aspects. They reflected freedom from false rationality, and restrictive customs and structures.
",It remains popular but also fragmented and diluted by the many derivative movements that it influenced.,"More an expression of philosophy and not the actual art-making itself. It attempts to expose psychological truth; stripping ordinary objects of their normal significance, to create a compelling image that was beyond ordinary formal organization in order to evoke empathy from the viewer.

","It began in the climate of the dissolutionment due to the aftermath of WW I. World War II created an environment of havoc especially for the European artists and writers that opposed Fascism and Nazism. During the 1930s Peggy Guggenheim, an important American art collector and market-maker, promoted Surrealists.","""resolve the previously contradictory conditions of dream and reality into an absolute reality, a super-reality"". - André Breton. ""There is only one difference between a madman and me. I am not mad."" - Salvador Dalí.","Automatism, automatic, free-association drawing as a method of art-making, suppressing conscious control over the creation process. Allowing the unconscious mind to direct creation. A use of surprise, unexpected juxtapositions imaging, non sequiturs and dreamlike representations. Spontaneity without censoring thoughts. Ordinary and depictive expressions with a large range of imagination ","Reflection of the human experience, in its personal, cultural, social, and political aspects. An unlocking of the subconscious. Enhanced sense of emotional intimacy. Subjects unnerving, illogical, strange as an unconscious expression, dream and unreality. Paradoxical, absurd, Illogical. cerebral. Incoherenent and distorted. Occasional reference to communism and anarchism.","Paris, France; London, Birmingham, England; New York, United States.","During the 1930s Peggy Guggenheim, an important American art collector, from a famous family, married Max Ernst and began promoting work by other Surrealists such as Yves Tanguy and the British artist John Tunnard.",Oil painting on canvas. Large variety of visual art formats. Theater. Writing. ,"Frottage (rubbing pastel or pencil on paper over uneven surface), Grattage (""scratching"" fresh paint with a sharp blade), Decalcomania (engravings and prints transferred to pottery or other materials). Mixed Media (mixed use of different materials). Oil painting using pigments and linseed oil (and nut oil).",null
Symbolism,1860 - 1910,Like viewing a dream or vision.,"Dreaming, sexuality, erotic, the mystic, sadness, melancholy, the unreal.","A visually distrinctive form of art by well known artists representing a major influential, worldwide movement in writing and poetry.",A rejection of realism and reflection of popular French liturature of the time. Artistic desire to visualize truths symbolically and through metaphorical images. Reaction against Naturalism and Realism movements.,"It evolved to Influence future styles such as Art Nouveau, Les Nabis, Expressionism and Surrealism. Bridged previous movements into the Modern art.","Painted a psychological, spiritual reality rendering dreams and visions. It used metaphors not literal symbols.","Symbolism was more a poetic, literary movement than an art movement.",“is to clothe the idea in sensuous form” - Albert Aurier.,"Not a style in technique but more a poetic philosophy.

","Mythological and dream imagery. Personal visions. Intensely personal, erotic, private, obscure, melancholy, evil and ambiguous references. Mystic and sometimes occult, perverse, morbid subject matter. Did not rely on literal emblems and symbols.

","Paris, France; Russia; Belgium.",The American Edgar Allan Poe was a significant influence on French liturature at the time.,Oil Painting on Canvas.,Oil painting using pigments and lindseed oil.,null