Mannerism,1510 - 1600,"Elongated forms such as figures, hands and necks. Almost unnaturally elegant with complex artificial poses.","A sense of tension, power, emotion, elegance, expressiveness, grace and sophistication. See the intellectual power and benefit of your leaders and state.",Very popular and pervasive art form immediately following the well know Renaissance masters.,"The High Renaissance achieved all artistic ideals, solved all problems. Young artists needed to find new expressions.  Mannerism emerged. Leveraged by Cosimo I  de Medici to rebrand Florence and family as the political and cultural center.","Eventually replaced by Baroque which considered Mannerism a decadent, inappropriate (nudity) and anarchic style that simply marked a degradation of High Renaissance art.  Mannerism popularity revived in the 20th century.","Exaggerates proportion, balance, and ideal beauty, often resulting in compositions that are asymmetrical or unnaturally elegant. Hands and necks are elongated, heads are disproportiantely small.",The Medici family used Mannerist artists and art form to elevate the status of the Medici dynasty.,"Mannerism was a derogatory term for the perceived decline of art after Raphael. Critics used the term in a negative sense, for works in which the artist seemed to rely too much on imagination or on conventions established by other artists. Some historians regard Mannerism as a degeneration of High Renaissance classicism, or even as an interlude between High Renaissance and Baroque.","Exaggerates and elongates figures, proportions, necks, hands, fingers often resulting in compositions that are asymmetrical or unnaturally elegant. Use of foreshortening as a visual means to give power and movement to key figures. Emphasizes compositional tension and instability rather than the balance and clarity like Renaissance painting immediate before it. Artist pay exquisite attention to surface and detail: porcelain-skinned figures recline in an even, tempered light, acknowledging the viewer with a cool glance. Works are often called 'cold' or 'aloof.'  This is typical of the so-called ""stylish style"" or Maniera in its maturity. Elongation of figures: often Mannerist work featured the elongation of the human figure – occasionally this contributed to the bizarre imagery of some Mannerist art. Distortion of perspective: in paintings, the distortion of perspective explored the ideals for creating a perfect space. However, the idea of perfection sometimes alluded to the creation of unique imagery. One way in which distortion was explored was through the technique of foreshortening. At times, when extreme distortion was utilized, it would render the image nearly impossible to decipher. Black backgrounds: Mannerist artists often utilized flat black backgrounds to present a full contrast of contours in order to create dramatic scenes. Black backgrounds also contributed to a creating sense of fantasy within the subject matter. Use of darkness and light: many Mannerists were interested in capturing the essence of the night sky through the use of intentional illumination, often creating a sense of fanatical scenes. Notably, special attention was paid to torch and moonlight to create dramatic scenes. Sculptural forms: Mannerism was greatly influenced by sculpture, which gained popularity in the sixteenth century. As a result, Mannerist artists often based their depictions of human bodies in reference to sculptures and prints. This allowed Mannerist artists to focus on creating dimension. Clarity of line: the attention that was paid to clean outlines of figures was prominent within Mannerism and differed largely from the Baroque and High Renaissance.The outlines of figures often allowed for more attention to detail. Composition and space: Mannerist artists rejected the ideals of the Renaissance, notably the technique of one-point perspective. Instead, there was an emphasis on atmospheric effects and distortion of perspective. The use of space in Mannerist works instead privileged crowded compositions with various forms and figures or scant compositions with emphasis on black backgrounds. Mannerist movement: the interest in the study of human movement often lead to Mannerist artists rendering a unique type of movement linked to serpentine positions. These positions often anticipate the movements of future positions because of their often-unstable motions figures. In addition, this technique attributes to the artist's experimentation of form. Painted frames: in some Mannerist works, painted frames were utilized to blend in with the background of paintings and at times, contribute to the overall composition of the artwork. This is at times prevalent when there is special attention paid to ornate detailing. Atmospheric effects: many Mannerists utilized the technique of sfumato, known as, ""the rendering of soft and hazy contours or surfaces""[33] in their paintings for rendering the streaming of light. Mannerist colour: a unique aspect of Mannerism was in addition to the experimentation of form, composition, and light, much of the same curiosity was applied to color. Many artworks toyed with pure and intense hues of blues, green, pinks, and yellows, which at times detract from the overall design of artworks, and at other times, compliment it. Additionally, when rending skin tone, artists would often concentrate on create overly creaming and light complexions and often utilize undertones of blue. Sculptures used figura serpentinata, often of two intertwined figures, that were interesting from all angles.","Human figures, classical and mythology themes. Religious, christian and catholic subject matter. Political propaganda. Portraiture had books, scripts due to period emphais on poetry and education as well as sexual iinnuendo and eroticism.","Florence, Italy; Rome, Italy.",Considered a decline in the arts but popular to modern viewers.,"Painting, Sculpture","Oil paint, marble.",null
Baroque,1600 - 1750,"Dark surrounding but with dramatic lighting of the subject. Moments of drama and emotion, shock and awe. Exaggerated  movement of flowing garments and posture.","Religious passion, piety, obedience, humbleness, praise, spiritual awakening and desire to convert to catholic views, identify biblical and religious scenes that convey religious meaning and inspire faith. A direct and emotional involvement in the subject. Convey awe, surprise and grandeur and to illustrate a religous knowlege  of ritual and cultic practices.",It was a powerful art technique that drove the expansion of Christianity which changed the history of the world.,The elaborate Baroque style used as a cultural strategy contolled by the Catholic Church to counter the simplicity and austerity of Protestant architecture and philosophy. It stresses catholic themes with more direct emotional religious theme and involvement to reconnect with people.    The 1563 catholic Council of Trent developed a cultural strategy to counter the Protestant Reformation movement. The Baroque art style was a direct reflection of Catholic Church control and guidelines on the creation and subject matter of art.,"Evolved to Rococo, a style characterized by increasingly decorative and elaborate works.","Intense and warm colours, particularly made use of the primary colours red, blue and yellow, frequently putting all three in close proximity. Avoidance of even, uniform lighting of Renaissance painting using strong contrasts of light and darkness on certain parts of the picture to direct attention to the central actions or figures. The composition avoided the tranquil scenes of Renaissance paintings, and chose the moments of the greatest movement and drama. Unlike the tranquil faces of Renaissance paintings, the faces in Baroque paintings clearly expressed their emotions. Asymmetry, with action occurring away from the centre of the picture, and created axes that were neither vertical nor horizontal, but slanting to the left or right, giving a sense of instability and movement. An impression of movement by having the costumes of the personages blown by the wind, or moved by their own gestures. Use of the subject of allegory; every painting told a story and had a message, often encrypted in symbols and allegorical characters, which an educated viewer was expected to know and read. There were emotional effects of color, overall harmony of the painting. A simplicity, precision, realism, and an emotional stimulus to piety. Contrast, movement, exuberant detail, deep colour, grandeur and surprise to achieve a sense of awe. An excess of ornamentation. The scene is crowded, dense, overlapping, loaded, in order to provoke shock effects.  Quadratura, or paintings in trompe-l'oeil, which literally ""fooled the eye"". These were usually painted on the stucco of ceilings or upper walls and balustrades, and gave the impression to those on the ground looking up were that they were seeing the heavens populated with crowds of angels, saints and other heavenly figures, set against painted skies and imaginary architecture. Baroque sculpture was inspired by ancient Roman statuary. Neo-Baroque objects: Horns of plenty, festoons, baby angels, female or male mascarons, oval cartouches, acanthus leaves, classical columns, caryatids, pediments.","The 1563 catholic Council of Trent ( developed a cultural strategy to counter the Protestant Reformation movement. The Baroque art style was a direct reflection of Catholic Church control and guidelines on the creation and subject matter of art, thus it was more ""modest"" using devices such as fig leafs to cover nudity.","From Portuguese word Barroco, used to refer to the pearls of irregular shapes; basically, the ugly pieces. So a negative connotation, criticizing the exuberance of Baroque not considered beautiful in it's time.","Heavy with an asymmetric arrangement in the overall subject. Extensive action occurring away from the centre of the picture, creating an axes that were neither vertical nor horizontal, but slanting to the left or right, giving a sense of instability and movement. An enhanced this impression of movement by having the costumes of the personages blown by the wind, or moved by their own gestures. Impressions of movement, emotion and drama. Every painting told a story and had a message, often encrypted in symbols and allegorical characters, which an educated viewer was expected to know and read. Emotional effects of color, overall harmony of the painting. Simplicity, precision, realism, and an emotional stimulus to piety. Religious subject matter. His realistic approach to the human figure, painted directly from life and dramatically spotlit against a dark background,. Elaborate effects to stir up religious passions. A single, powerful effect. Contrast, movement, exuberant detail, deep colour, grandeur and surprise to achieve a sense of awe. excess of ornamentation. Crowded, dense, overlapping, loaded, in order to provoke shock effects. New motifs: artouche, trophies and weapons, baskets of fruit or flowers, and others, made in marquetry, stucco, or carved. Absurdly complex. magic, complexity, confusion, and excess. Stucco materials, twisted columns, 3D figures, frames, angels, domes. Twisted column in the interior of churches is signature Baroque providing a sense of motion, dramatic new way of reflecting light. Cartouches are plaques carved of marble or stone, usually oval and with a rounded surface, which carried images or text in gilded letters, and were placed as interior decoration or above the doorways of buildings, delivering messages to those below. They showed a wide variety of invention, and were found in all types of buildings, from cathedrals and palaces to small chapels. Trompe-l'œil effects. Quadratura, or paintings in trompe-l'oeil, which literally ""fooled the eye"". These were usually painted on the stucco of ceilings or upper walls and balustrades, and gave the impression to those on the ground looking up were that they were seeing the heavens populated with crowds of angels, saints and other heavenly figures, set against painted skies and imaginary architecture. Baroque sculpture was inspired by ancient Roman statuary, particularly by the famous statue of Laocoön. Neo-Baroque objectts: Horns of plenty, festoons, baby angels, female or male mascarons, oval cartouches, acanthus leaves, classical columns, caryatids, pediments.","Religous, Catholic, portraits, landscapes, history, mythology, allegorical.","Rome, Italy; Northern Europe.","The word ""baroque"" comes from a similar word in Spanish, Portuguese, and French that means ""rough pearl"". Baroque artist Caravaggio's talent earned and then lost a knighthood in Malta, also gained him a pardon from a murder conviction in Rome just by offing his paintings.","Altarpieces, altar painting, architecture, twisting columns in the interior of churches, classical ornate columns, decorative detail such as festoons or garlands, landscapes, portraits, sculpture. Gropuings of armor, arrows, objects (trophies) and weapons, baskets of fruit or flowers, 3D figures, frames, angels and domes. Twisted columns give a sense of motion and a dramatic new way of reflecting light. Plaques (cartouches) of carved of marble or stone, usually oval and with a rounded surface, which carried images or text in gilded letters, placed as interior decoration or above the doorways of buildings, delivering messages to those below. Trompe-l'œil effects (looks real to your eye). Common objects depicted are: horns of plenty, festoons, plant and fruit garlands, baby angels, female or male mascarons, oval cartouches (plaques), acanthus leaves, classical columns, caryatids and triangular pediments. Elaborate and frequent use of stucco material.","Oil paint, marble, stone.",null
Rococo,1710 - 1790,"Ornate, theatrical. Pastel whites, pale yellows, pearl grays, pinks, baby blues, mint greens and gold gilding. Superficial, degenerate, illogical, frivolous, erotic, excessively ornate. Cherubs, seashells, twisting vines, broad leaves, branches, musical instruments, garlands of fruits and flowers. Ornately framed mirrors, multicolored venetian glass chandelers. White stucco material and illusionary wall, ceiling painting.","Mildly erotic, amorous, romantic, frivolous. Feel an air of aristocractic sophistication. Be surprised, awed with the amount of stylish ornamentation.","Seen extensively and across many forms of arts. An extremely popular art style across most of Europe seen often in residential salons, palaces, buildings and aristocratic settings.","A reaction against the Style Louis XIV and his reign having featured majesty, formality, geometry, harmony and regularity. Rococo developed by craftspeople and designers rather than architects, so found primarily in furniture, silver and ceramics.
","The style-leading French art establishment preferred a more noble, grande, serious, symmetrical and grounded in antiquity - a neo-classical art direction influenced by the discoveries of Roman antiquities at Herculaneum and Pompeii.","A style without rules. Exuberant decoration, with an abundance of curves, counter-curves, undulations and elements modeled on nature. The exteriors of buildings are often simple, while the interiors are entirely dominated by their ornament. Highly theatrical style. Floor plans of churches were often complex, featuring interlocking ovals; In palaces, grand stairways became centrepieces, and offered different points of view of the decoration. Asymmetrical shells, acanthus and other leaves, birds, bouquets of flowers, fruits, musical instruments, angels and Chinoiserie (pagodas, dragons, monkeys, bizarre flowers and Chinese people). Painted scenes of passion and intimate amorous subjects.","It was a favored style of Madame de Pompadour, the official Chief Mistress of Louis XV. Often used to add eroticism to various collections.","""...ridiculous jumble of shells, dragons, reeds, palm-trees and plants"". Sometimes used as a term for out of style and old-fashioned belonging to the style of the 18th century. A fantasy-based ""aristocratic"" art. An insult upon the rights of men. A ""petit"" (small) style, not a grand, noble style.","Differs from Baroque with the: partial abandonment of symmetry, everything being composed of graceful lines and curves; the huge quantity of asymmetrical curves and C-shaped volutes; the very wide use of flowers in ornamentation, an example being festoons made of flowers; Chinese and Japanese motifs; warm pastel colours (whitish-yellow, cream-colored, pearl greys, very light blues). Rococo uses: explosions of forms that cascaded down the walls; elaborately ornate framed mirrors and multicolored venetian glass; illusionist ceiling paintings (trompe-l'œil).","Passionate, mildly erotic and intimately amorous scenes. Classical themes, mythological subjects, gallantry, decorative allegories, and romantic pastoral scenes (beautifully dressed women in swings in the garden). Chinese and Japanese motifs. Sinuous curves and vegetal designs.","Hôtel de Soubise, Paris. Paris, France. Austria. Venice, Murano, Italy. Würzburg Residence, Bavaria, Germany.","The name Rococo was a variation of Rocaille, originally a method of decorating Renaissance grottoes and fountains using pebbles, rocks, seashells and cement.","Portrait paintings. Interior building decoration and ornamentation. Illusionistic ceiling and wall paintings. Allegories, tapestries, carpets, theatre decoration. Ceramic, porcelain figurines.","Decorative items. Molded, painted or white stucco, wood carving with use of different colored woods (usually oak, beech or walnut). Lacquered wood in the Japanese style. Ornaments of gilded gold and bronze. Furniture, Marble tops of commodes or tables. Silverware. Venetian glassware (Murano glass) and multicolour chandeliers, mirrors with extremely ornate frames. Small-scale ceramics and porcelain sculptures and figurines.",null
Vanitas,1550 - 1650,"Human skulls with a realistic still life of flowers insects, jewelry and timepieces dominate. ","Consider your morality and repent. Your life is short so avoid  wasting your life on the frivolous persuit of fame, fortune and useless pleasrure. Death plays no favorites no  matter one's economic social and financial status.",It was a very popular Dutch art style where many of the same themes and symbols are echoed even today.,The Dutch Republic protestants were rejecting excessive catholic holy images and iconography as well as rejecting catholic Spanish rulers. It was a time of great mercantile art patronage and frequent military conflict thus a focus on the true meaning of life.,Vanitas lost its commercial and religious potency when the combative protestant reformation losts its momentum at the end of the Dutch Golden Age (1650).,"Realistically rendered still life. Baroque. The most common motifs are representations of wealth: gold, purses, and jewellery; representations of knowledge: books, spyglass, maps, and pens; representations of pleasure: food, wine cups, and fabrics. Lastly, representations of decay; skulls, flowers, candles, and hourglasses. The pallet is usually dark and limited, createing a somber and brooding mood with a singular light source.",Developed as a reaction to protestantism and materialism.,"The Latin noun vanitas (from the Latin adjective vanus 'empty') means 'emptiness', 'futility', or 'worthlessness',","Fine art painting, dark palette, still life, realism.","Human vanity, mortality, brevity of life, Protestant ethics","Leiden, in the United Provinces of the Netherlands, Flanders, Netherlands and Northern Europe.","Vanitas or, Memento mori, began appearing on the back of portraits in 15th-century Europe, often featuring skulls painted within a niche, and accompanied by an admonitory motto. Bubble are used often as a symbol of the fragility of life.","Painting, Still Life, Engraving","Oil paint, print engraving.",null
Neoclassicism,1740 - 1835,"Mimics, copies, and inspired by ancient Roman art.","Order, seriousness, severity, patriotism, civility, honorableness, calm granduer, republicanism.","Simply copied Roman style but still major influence on art style today driving many major branches such as United States Federal style, French Empire style and English Adam style.","Replaced the eroticism frivolity, fantasy-based aristocratic art of the Rococo style with a style that was orderly, serious, anti-aristocratic. Born from the French Revolution and signaling major societal change.",Remains strong into the 21st century.,"Mimics ancient Greek classical form, style and structure. Realistic, severe, rigid and unemotional. Often depicts the grandeur of ancient Greece and Rome. Has elements of the homoeroticism of Greco-Roman art and erotic male sculptures. Often it was directly connected to contemporary political events such as the French Revolution. It is a style that was orderly and serious in character. French Neoclassism painters emphasis's patriotism, as well as a sense of civility and honorableness. Very simple line drawing, figures mostly in profile.",Neoclassicism became a propaganda vehicle for Republicanism and the bloody purge of artistocrats during the French Revolution of 1789.,"""...insipid..."" and ""almost entirely uninteresting to us""— Kenneth Clark.","Use of straight lines, a smooth paint surface, the depiction of light, a minimal use of color, and the clear, crisp definition of forms.","Classical mythology and subject matter, erotic male sculptures, Roman subject, patriotism, civility, honorableness, contemporary politics, revolutionary ideas, French Revolution, anti-aristocratic, republican virtues, ancient buildings, ancient ruins.","Rome, Italy; Paris, France","The key neoclassical artist Jacques-Louis David became active in the anti-aristocrative, republican, French Revolution politics, but then, as propagandist for the Emperor Napoleon.","Sculpture, painting, architecture, decorative arts",Oil paint on canvas.,null
