Name,Key Timespan,A Quick Take,What You're To Feel,Why You Should You Care,Why it Evolved,Why it Ended,Unique ????,Relevant History,Opinions and Commentary,Style,Typical Subjects,Geographic Focus,Interesting Facts,Prominant Formats,New or Dominant Materials,Relevant Images
Egyptian,-3000 - 100 AD,"Stone materials, highly symbolic, multiple small symbols (words), unnatural looking flat human figures standing sideways. Realistic wood panel portraits were painted in the illusionistic Greco-Roman style.","An understanding of the: afterlife; the religious, ideological view of the world; the cosmic purpose of maintaining order.",Influenced the Greek artists who influenced all of Western Art.,Highly symbolic intended to facilitate and influence the human passage into the after-life.," Influenced, but was too rigid, for Classical period artists who desired the perfect human form and expression of human athletic and other achievements. But influential to Greek art.","Ancient Egyptian art includes the painting, sculpture, architecture, and other arts produced by the civilization in the lower Nile Valley from 5000 BCE to 300 CE. Ancient Egyptian art reached considerable sophistication in painting and sculpture, and was both highly stylized and symbolic.","30 BC marked the Roman conquest of Egypt beginning cross-cultural influences. Obelisks and Egyptian-style architecture and sculpture were installed in Rome. Cult of Isis, the Egyptian mother goddess, impacted Rome. Egyptian gods were increasingly represented in classicizing style. Egyptian funerary arts evolved in a new and creative direction adopting dress and hair styles. Wood panel portraits were painted in the illusionistic Greco-Roman style.","""Ancient Egyptian art reached considerable sophistication in painting and sculpture , and was both highly stylized and symbolic."" - Boundless Art History.","Practical and functional. Designed to benefit a divine or deceased recipient. Statues show a formal frontality, meaning they are arranged straight ahead, because they were designed to face the ritual being performed before them. Ancient Egyptian art includes the painting, sculpture, architecture, and other arts produced by the civilization in the lower Nile Valley from 5000 BCE to 300 CE. Ancient Egyptian art reached considerable sophistication in painting and sculpture, and was both highly stylized and symbolic.","Burial, afterlife, religious, ideology. An idealized, unrealistic view of the world. the Nile River, the two kingdoms (the Upper in the south and the Lower in the north). Agriculture and hunting, animals, the Heavens, glorifing of the Pharaohs and Gods. Religious beliefs. The facilitation of the human passage into the after-life.","Egypt; Museo delle Antichità Egizie, Turin, Italy; The Metropolitan Museum of Art, New York City, NY;  Louvre Museum, Paris, France; The British Museum, London, UK; Ägyptisches Museum und Papyrussammlung, Berlin, Germany; Museum of Fine Arts, Boston, MA; Petrie Museum of Egyptian Archaeology, London, UK; University of Chicago, Chicago, IL","A majority of known Egyptian art, which highly influenced the Greeks, was buried in tombs with afterlife as subject matter. They were never intended to be seen in public. Painted mummy cases were a type of naturalistic painted portrait on wooden boards belong to the tradition of panel painting and are the only large body of art from that tradition to have survived.","Limestone wall painting, sarcophagi (coffins). Statues, reliefs, sculptures, drawings on papyrus, glazed pottery, jewelry, ivories, tombs, monuments, architecural ornamentation, glazed ceramic ware (faience). Roman period ""Faiyum"" portraits (painted mummy cases on wooden boards).","Color manufacturing started in 4000 BC. Encaustic paint material (pigments blended with wax, eggs or resins). Faience (glazed ceramic ware). Colors were used in a binder to make them stick to the dry (versus the more familiar wet) plaster on limestone walls of tombs. Panels, painted wooden boards (i.e. mummy cases). Colors: primarily: black, red, yellow, brown, blue, and green pigments. Paints: ground pigments using gums or animal glue. Egyptian blue-first. The Egyptians also used azurite (deep-blue copper mineral) and realgar (red arsenic sulfide mineral). They innovated vegetable dyes and dyes fixed with a transparent white powder base to produce pigments (madder and carmine lakes). Dyes were from parts of plants mixed with hydrated clay or tannin. Egyptian contributed apyrus, glass, and desert minerals, ores, and fine stones such as porphyry (purple, hard marble used only for the  most important people) and granite.",null
Classical,500 BC - 323 BC,"Naked human form in perfect proportions, showing emotions.","To marvel at human achievement and accomplishment different from ""barbarian,"" non-Greek peoples. Note the perfection and beauty of the male body but also the nobility of character.","It is the single most influental period of art. Every art form, even today, was influenced by the technique, style and subject matter of this art period.","Influenced by Egyptian art ridgid statues of pharaohs using a new form of rigid and impersonal kuoros figurines. But there was a practical need for fitting style, art, figures, stories into architectural spaces. A reverance grew for the perfect human form and expression of human athletic and other achievements. Growth generated by democracy with the end of the aristocratic culture.",Replaced by the Hellenistic Age. Alexander the Great died thus Greek art influence faded. The empire fractured and artististic style dispersed and diluted.,"Sculpture of marble or bronze. Poses became more naturalistic and the technical skill of Greek sculptors in depicting the human form in a variety of poses greatly increased. Statues began to depict real people. The subjects had faces with human emotions. Funeral statuary evolved from the rigid and impersonal kouros of the Archaic period to the highly personal family groups. Real people were depicted, typically showing the departed taking his dignified leave from their family.",Democracy flourished and aristocratic culture weakened. Alexander the Great died in 323 BC and the empire fractured.,"""we admire the work of art but despise the maker of it"" - Plutarch","Sculpture of marble or bronze. Subjects showed human emotions. Poses became more naturalistic and the technical skill of Greek sculptors in depicting the human form in a variety of poses greatly increased. From about 500 BC statues began to depict real people. Funeral statuary evolved from the rigid and impersonal kouros of the Archaic period to the highly personal family groups, they increasingly depicted real people, typically showing the departed taking his dignified leave from their family.","Figurative sculpture, male nudes, Gods, goddesses, mythological studies, Centaur battles, battles with Amazon female warriors, Military parades, triumphs, processions, funerial, burial, tombstone, stela, personal family groups, mourning mothers, dutiful sons","Athens, Greece; Rome, Italy",Little or no art exists from this period. Most is known from Roman art copies and some text.,"Relief sculpture, decorative frieze, sculpture in the round, pediments, funeral statuary, chryselephantine statues, terracotta figurines, temple cult statues, public memorials, decorations of buildings, Attic pottery, vases, krators, stela, tombstones, herms","Sedentary clay painted with slip (black, white gloss for color), marble, cast bronze, vase painting, friezes.",null
Grotesque,64 - 68. Revived in 16 c.,"Artistic doodling, decorative.","Notice the Intrigues, amusements and decorations with bizarre, mysterious, entertaining, magnificent, fantastic, hideous, ugly, incongruous, unpleasant, or the disgusting illusions that enhances your visual experience.",Probably the most influential art all around you that you know nothing about. Sponsored by the notorious Roman emperor Nero and commercialized by Renaissance legend Raphael.,Believed to be a decorative technique to cover large blank areas of a palace.,"Evolved into newer, fresher art forms. Became outdated.","Look for scrawling, running, meandering, weird shapes, distorted forms, mophing into plants, vegetation, decorative fluorishes blended from human, animal and fantastical beast forms. Strange, mysterious, magnificent, fantastic, hideous, ugly, incongruous, unpleasant, or disgusting, and thus is often used to describe weird shapes and distorted forms such as Halloween masks. Gargoyles are grotesques but with rain spouts. Ornamental arrangements of arabesques with interlaced garlands and small and fantastic human and animal figures, usually set out in a symmetrical pattern around some form of architectural framework, though this may be very flimsy.",Discovered by a boy crawling down a hole in Rome. Copied and reinvigorated by Raphael and subsquently used all over the art world.,"""Grotesques are a type of extremely licentious and absurd painting done by the ancients ... without any logic, so that a weight is attached to a thin thread which could not support it, a horse is given legs made of leaves, a man has crane's legs, with countless other impossible absurdities; and the bizarrer the painter's imagination, the higher he was rated"". - Vasari","Ornamental arrangements of arabesques with interlaced garlands and small and fantastic human, animal figures, monsters, often using mythologial figures and syphinxes as subject matter.","Nonsensical, whimsical, vulgary subject matter of hybrid forms. Tiny faces, small figurative subjects.","Rome, Italy; Vatican, Italy","First Roman versions were discovered by a boy climbing down into a dark, grotto-like cavern near the Colosseum in Rome. Grotto, thus, Grotesque.","Frescos, wall painting, ceiling painting, decorative, architecture ornamentation, pottery, etchings, mosaics, engravings, woodwork, book illustration","Ornamental roman style wall painting on stucco, fresco. Paint, pottery.",null
Byzantine,500 - 1450,"Gold colors, gold leaf, gold gilding. Lettering identifying the subjects. Unnatural looking. Mixed use of materials, often metals.","An uplifting of the mind to the spiritual, religous conversion. Know better the religous ritual and cultic practices. See the paths of spiritual realization and the principles of Christianity. Feel the conclusiveness and identity of biblical, religious scenes conveying religious meaning and inspiring faith.",Remains important as images and symbols used by majority of the population of the Christian world today.,Very distinct from Roman Catholic painting style. Evolved from the Christianized Greek culture of the Eastern Roman Empire.,"Fall of Constantinople (Istanbul, Turkey) to the Ottoman Turks in 1453. In the 19th and early 20th centuries, icon painting in Russia went into a great decline with the arrival of machine lithography on paper and tin, which could produce icons in great quantity and much more cheaply than the workshops of painters.","Use of gold and goldleaf, mixing metals with painting. Names written on the background. Use of two to three cross bars on a cross.",Western Christianity split from Eastern (Byzantine) Orthodox Christianity.,"Giorgio Vasari attributed move from realistic art to a decline in artistic skills and standards, which had in turn been revived by his contemporaries in the Italian Renaissance. ""our own appreciation of Byzantine art stems largely from the fact that this art is not naturalistic; yet the Byzantines themselves, judging by their extant statements, regarded it as being highly naturalistic and as being directly in the tradition of Phidias, Apelles, and Zeuxis.""","Stormy and rigid. Abstract and unnatural. Heavy use of gold and goldleaf. Lettering of names of the subjects. Mixed use of metals, jewels and paintings on wood panels. Very ornate. If classical art was marked by the attempt to create representations that mimicked reality as closely as possible, Byzantine art seems to have abandoned this attempt in favor of a more symbolic approach. Icons are considered to be the Gospel in paint, and therefore careful attention is paid to ensure that the Gospel is faithfully and accurately conveyed.","Religious, Eastern Orthodox, christian, catholic, New Testament, Passion of Christ, Virgin Mary and Baby Jesus, saints, emperors, kings, queens, rulers and classical mythology. Icons are considered to be the Gospel in paint, and therefore careful attention is paid to ensure that the Gospel with it's symbols are faithfully and accurately conveyed.","Constantinople, Byzantine Empire, Turkey, Eastern Europe, Ottoman Empire, Greece, Cyprus, Serbia, Bulgaria, Romania, Russia, Hagia Sophia","In the 19th and early 20th centuries, icon painting in Russia went into a great decline with the arrival of machine lithography on paper and tin, which could produce icons in great quantity and much more cheaply than the workshops of painters.","Altarpieces, altar paintings, altar screens, frescos, mosaics, ivory relief sculpture usually presented in small portable objects and common objects.","Egg tempera paint pigments on specially prepared wooden panels, or on cloth glued onto wooden panels. Silver metal pieces laid over paintings, gold gilding, gold leaf. Mosaics and ceramic tiles.",null
Gothic,1150 - 1580,"More realistic painting style. Use of gold and goldleaf. Pointed, ornate windows and arches. Stained glass.","An emotional stimulus to spirituality and piety energizing your religous conversion. See a moral narrative. Better understand the Old Testiment and the New Testiment. Use as a devotion to the Virgin Mary and the saints. Understand the religion, ritual, cultic practices and the paths to spiritual realization. Internalize the principles of Christianity and and conclusively identify biblical, religious scenes and convey religious meaning.",The Church's art form to communicate and structure a dark ages society that was in total disarray.,A religious oriented and stable French monarchy along with the concentration of more people in French cities provided the optimal environment to develop the Gothic style starting with church architecture. It then spread to all Europe. Artists wanted to infuse more light into dark church interiors so larger windows of stained glass evolved. Church leaders wanted to bring structure and order to the illiterate masses to tell a religous story.,"The Renassiance art style replaced Gothic due to a need for expanded religious subject matter with more attractive art of real, human subjects informed by the discovey and appreciation of more attractive Greek classical liturature and sculpture. Renassiance was an expanded desire to reflect on man's humanity and flourished with new funding and subject interests from merchant classes.",Heavy use of gold and goldleaf. Pointed ornate windows and arches. Large windows of stained glass.,The Great Famine of 1315–17 and Black Death of 1347-1351 reduced the population perhaps by half or more. Popular revolts in late-medieval Europe and civil wars between nobles such as the Wars of the Roses were common—with France fighting internally nine times—and there were international conflicts between kings such as France and England in the Hundred Years' War.,"The word ""Gothic"" for art was initially used as a synonym for ""Barbaric"", and was therefore negative. Gothic 'barbarian' styles filtering down from north of the Alps posed a similar threat to the classical revival promoted by the early Renaissance. Gothic is a ""monstrous and barbarous"" ""disorder""- Vasari. ""Pointed arches of northern architecture were an echo of the primitive huts"" - Raphael. The Gothic era had “forgotten” how to create realistic works of art, or art influenced by the classical age.","Heavy use of gold and goldleaf. Mulitple wood panels of painted subjects. Typical architectural elements: rib vault, flying buttress, and pointed (Gothic) arch, stained-glass windows dominated by yellow, more windows for light, use of stone, Gothic ornamental detailing, monumental sculpture on the walls of cathedrals and abbeys,  Life-size tomb effigies in stone or alabaster, grand multi-level tombs. Church fascades have large art reliefs, rows of sculpted figures framing and arching over the doors and portals. Statues show an elegant but exaggerated columnar elongation, some show a more naturalistic style and increasing detachment from the wall behind. Painted figures become more animated in pose and facial expression and smaller in relation to the background of scenes. Presence of small figures (donors) on the side of paintings, often in profile, who paid for the art and were smaller than the Virgin or saints.","Religious, christian, catholic, popular literature. Stories of the New Testament and the Old Testament side by side. Jesus Christ, Virgin Mary,  the saints, and Marian devotion.","Gothic style first emerged at Abbey Church of St. Denis, Île-de-France, France.","The Abbey Church of Saint Denis, France is the first Gothic church architecture and art.","Church architecture, stained glass, Illuminated manuscripts, painting on wood panel, wood sculpture, stone sculpture, mosaics, frescos, monumental sculptures, altarpieces, alta painting, life-size tomb effigies, grand multi-level tombs, small ivories and small devotional statues.","Oil paint, wood panel (oak, walnut), stained glass, hand painted religous books (Illuminations), fresco.",null
Early Renaissance,1350 - 1450,"Better techniques than the flat-planed and two-dimensional icon artworks. One-point linear persepective. Shallow carving to create atmospheric effect, foreshortening, naturalistic and anatomical detail, proportion, and the use of chiaroscuro (light highlighting) and trompe l'oeil to create illusionary realities.","Stronger connection to more realistic, emotional art. More introspection of yourself as a human. An intellectual and spiritual awakening. More feelings about your morality, piety, religous conversion, education and understanding of ritual and cultic practices. Seeing and feeling the paths of spiritual realization and the principles of Christianity.",Huge leap of talent and techniques with huge influence on the Western world. ,"Desire support and direction by new patrons such as the Medici's and the merchant class to advanced the asthetics of ""barbaric"" Gothic art back to the beauty of Greek classical art. To consider what humans feel and think. A want for expanded religious subject matter using more real, human subjects combined with the discovey and appreciation of Greek classical liturature and sculpture. Also, increased social mobility, daily life moved away from religious ardor, a  more rational economy with credit developed.
","Lead to High Renaissance, North European Renaissance, Mannerism, and Baroque periods.","The illusion of depth. Battle scenes, historical events, contemporary scenses, portraits, and depictions of ordinary people appeared.. Art was no longer a way to solely elevate the devotional, but became a way to document the people and events of contemporary times.","Rise of money, thus patronage, by merchant middle classes expanding art into subjects such as how humans feel, portaits, events and their lives.","Some observers question whether the Renaissance was a cultural ""advance"" from the Middle Ages or a period of pessimism and nostalgia for classical antiquity.","Early use of oil painting versus egg yolk added new colors and effects (tempura). Realistic use of colors and light. Ethereal, foggy backgrounds. Romantized landscapes. An abundance of sharply outlined characters suddenly appears, robust, clear-cut personalities. Lighting, linear and atmospheric perspective, accurate anatomy, foreshortening and human characterisation. The use of proportions. Treating a painting as a window into space. Foreshortening, shortening lines in a drawing to create an illusion of depth. Sfumato, blurring, softening sharp outlines by subtle and gradual blending of one color into another for depth or three-dimensionality. Chiaroscuro, strong contrast between light and dark for depth or three-dimensionality (expanded in Baroque art.","Expansion beyond religious devotional. Idealized beauty, battle scenes, historical events, contemporary scenes, portraits with character and individuality, and depictions of ordinary people. Art was no longer a way to solely elevate the devotional, but became a way to document the people and events of contemporary times. Romantized landscapes. Portraits with sharply outlined characters suddenly appears, robust, clear-cut personalities. Emphasis on humans, rugged and manly figures. Energetic and powerful beings to replace shy and feminine. The figures standing firmly upon their own feet and become part of their earthly home.",Catholic religious contexts. Frescos on walls and ceilings. Paintings on altars and church walls.,Michelangelo and Leonardo became rivals and competed against each other in an art competition for the city government hall. Neither one finished their commission.,"Painting, sculpture, architecture, frescos, altarpieces, altar painting, cycles, small works for private religious devotion, decorative ornament, architectural ornamentation.","Tempera paint (Any pigment which mixed with a water soluble binder such as egg yolk, glair (egg white), gum arabic or animal glue), frescos (pigments painted into wet plaster). Painting on wooden panels (oak, walnut). Oil paints (pigments mixed with oil) were just beginning.",Cross=founded_the_Church=Emotional_Early_Renaissance_Humanity_suffering_pain_death_humble_realistic_add_edit_movements_Botticelli_following_Savonarola_modest_deeply_religious_copywrited_auction=Man_of_Sorrows.jpeg
High Renaissance,1450 - 1530,"Beautiful, realistic, pleasing art with masterful art technique and advancements built upon Early Renaissance.","Inspires your intellectual and spiritual awakening, morality, piety, religous conversion and education as well as ritual and cultic practices. Portrays the principles of Christianity by convincingly identifying religious scenes with meaning.",History's most important period of art and talent perfecting oil painting and drawing skill technique.,"Support and direction by new art patrons and merchant class such as the Medici's who wanted to advanced the asthetics of ""barbaric"" Gothic art back to the beauty of Greek classical art.  A desire to push beyond religious subject matter to more real, human subjects inspired by the discovery and appreciation of Greek classical liturature and sculpture.","Internal wars among Italian city-states, Spanish, French and German invasions; shifting trade routes changed economies thus art patronage. The Catholic Church increased control and censorship responding to the Protestant Reformation instituting the Roman Inquisition making humanism and contrary thinking a heresy punishable by death. The Renaissance thus evolved to the Age of Enlightenment and Baroque. Rome was brutally sacked in 1527 providing a definitive event for the ending of the style.
","Objective of reflecting ideal beauty. The realistic use of colors and light. Light was evenly used over the entire painting.  There were ethereal, foggy backgrounds with romantized landscapes. An abundance of sharply outlined characters, robust, clear-cut personalities. A general and uniform type of beauty prevailed. The illusion of depth was often used.","The bronze doors of the Florence Bapistry considered to mark the beginning of High Reniassance in 1452. May 6, 1527 Rome was violently sacked by Charles V, thus artists shops were scattered and fragmented.","""The Italians, having before their eyes the treasures of ancient statuary, were able to acquire the purity and correctness of the drawing quickly. They have learned to give their figures this suppleness and elegance of pose, and to clothe them with artistically arranged draperies. The Germans, on the contrary, had only one model: nature. Also if their poses have some stiffness, so their heads are almost all portraits, they great charm and delicious naiveté in expression. In a way, they are closer to the truth."" - Albert Durer.","Idealized and perfected human figures. Use of translucent, glowing, jewel-like oil painting effects. Communicates to the illiterate through use of symbols. Realistic use of colors and light. Use of perspective, accurate anatomy, 3D foreshortening and human characterisation. Development of sfumato, the blurring or softening of sharp outlines by subtle and gradual blending of one tone into another.","Religious, catholic, christian, historical, political, portraits, figurative, classical mythology, classical roman, allegory, aristocracy, theocracy, popes, church hierarchy, wealthy, powerful rulers, wealthy merchants.","Florence, Italy; Rome, Italy; Paris, France",Raphael wanted to paint the ceiling of the Sistine Chapel but lost that job to Michelangelo who didn't want to paint but preferring to sculpt while Leonardo didn't see himself as an artist at all.,"Painting, sculpture, architecture, frescos, altarpieces, altar painting, cycles, small works for private religious devotion, decorative ornament, architectural ornamentation.","Oil paints (pigments mixed with oil); frescos (pigments painted into wet plaster); tempera paint (any pigment which mixed with a water soluble binder such as egg yolk, glair (egg white); watercolors (first time they were in continuous use); more use of canvas surfaces and continued painting wooden panels (oak, walnut).",null
